id,refrany,part1,part2
1, Qui no vulgui pols que no vagi a l'era, 
2, Al maig, cada dia un raig ,
3, No diguis blat fins que no el tinguis al sac i ben lligat,
4, Març, marçot, mata la vella i la jove si pot,
5, A la taula i al llit al primer crit,
6, Cel rogent, pluja o vent,
7, Per Nadal, cada ovella al seu corral ,
8, Tal faràs, tal trobaràs,
9, Qui dia passa, any empeny,
10, A l'estiu tota cuca viu,
11, De porc i de senyor se n'ha de venir de men,
12, Per Santa Llúcia, un pas de puça; per Nadal, un pa, de pardal; per Sant Esteve, un pas de llebre 
13, Quan la Candelera plora, l'hivern és fora, quan la Candelera riu, l'hivern és viu; tant si plora com si riu, l'hivern és viu 
14, Hostes vingueren que de casa ens tragueren,
15, De mica en mica s'omple la pica,
16, Al pot petit hi ha la bona confitura,
17, Si vols estar ben servit, fes-te tu mateix el llit,
18, Pel juny, la falç al puny,
19, Qui de jove no treballa, quan és vel, dorm a la palla  
20, A la taula d'en Bernat, qui no hi és, no hi és comptat  
21, Qui canta a la taula i xiula al lli, no té el seny gaire acomplit 
22, A l'abril, cada gota val per mil ,
23, D'on no n'hi ha, no en pot rajar,
24, Quan al cel hi ha cabretes, a la terra,hi ha pastetes (o bassetes) 
25, Els testos s'assemblen a les olles,
26, De Joans, Joseps i ases, n'hi ha a totes les case,
27, Qui no té feina, el gat pentina ,
28, A l'abril, aigües (o pluges) mil,
29, Per Nadal, qui res no estrena, res no va,
30, Per la Mare de Déu d'Agost, a les set ja és fos,
31, Una flor no fa estiu, ni dues primavera,
32, Gat escaldat, de l'aigua tèbia fuig,
33, Tants caps, tants barrets,
34, Qui canta els seus mals espanta ,
35, Qui no té cap ha de tenir cames,
36, Qui vulgui peix que es mulli el cul,
37, Qui no s'arrisca no pisca ,
38, La guineu quan no les pot haver diu que,són verdes 
39, Al juliol, ni dona ni cargol ,
40, Quan el Montgó porta capell, pica espart,i fes cordell 
41, A sants i a minyons no els prometi, si no els dons  
42, Carrers mullats, calaixos eixuts,
43, Val més boig conegut que savi per conèixer,
44, Qui no plora no mama,
45, Barcelona és bona si la bossa sona,
46, S'atrapa abans un mentider que un coi,
47, Home casat, burro espatllat ,
48, De ponent, ni vent ni gent,
49, Qui la fa, la paga ,
50, Caldera vella, bony o forat ,
51, De més verdes en maduren,
52, El més calent és a l'aigüera ,
53, Qui va amb un coix, al cap de l'any ho són, tots dos  
54, Tanta roba i tan poc sabó! ,
55, Pagant, sant Pere canta ,
56, No deixes les sendes velles per les novelle,
57, No vols caldo? Dues tasses!,
58, Diu el mort al degollat: qui t'ha fet eixe forat,
59, Feina feta no fa destorb,
60, Tira més un pèl de figa que una marom, de barco  
61, Arrancada de cavall, parada de ross,
62, Qui té el cul llogat no seu quan vol,
63, Home roig i gos pelut, primer mort, que conegut  
64, Gent jove, pa tou ,
65, Roda el món i torna al Born ,
66, A cada bugada es perd un llençol,
67, A poc a poc i bona lletra ,
68, Tot bon català té fred després de menja,
69, Per Sant Joan, bacores, verdes o madures, però segures 
70, Qui té gana somia pa ,
71, Qui vol lluir ha de patir ,
72, Any de neu, any de Déu,
73, Qui oli remena, els dits se n'unta ,
74, Tota pedra fa paret,
75, Qui guarda quan té, menja quan vol,
76, A la vora del riu no t'hi facis el niu ,
77, Gallina vella fa bon caldo,
78, Qui menja sopes se les pensa totes,
79, Em fas festes i no me'n solies fer, és que em vols fotre o m'has de menester 
80, Quan el mal ve d'Almansa, a tots alcança,
81, Qui té boca s'equivoca ,
82, N'hi ha per llogar-hi cadires ,
83, A cada porc li arriba el seu Sant Martí,
84, Brams d'ase no arriben al cel,
85, Valencià (o Andorrà, o Català, o Vigatà, i home de bé, no pot ser 
86, De llevant o de ponent, de la don, sigues parent 
87, De moliner mudaràs i de lladre no t'escaparà,
88, El sabater és el que va més mal calça,
89, Advocats i procuradors, a l'infer,
 de dos en dos 
90, No diguis mai d'aquesta aigua no en beur,
91, Déu dona faves a qui no té queixal,
92, Qui paga mana,
93, Fer Pasqua abans de Rams,
94, No es pot repicar i anar a missa ,
95, Bon vent i barca nova,
96, Ja pots xiular si l'ase no vol beure,
97, Salut i força al canut! ,
98, De desagraïts, l'infern n'és ple,
99, Sempre plou sobre mullat ,
100, Músic pagat no fa bon so,